review_id,product_name,user_name,review,review_count,rating_overall,rating_ease_of_use,rating_customer_support,rating_features_functionality,rating_value_for_money,rating_likelihood_to_recommend,product_id
459,Ephesoft Transact,Jeff J.,"Overall: We have partnered with Ephesoft for about five years now, and the ability to offer this product to our clients has enabled us to continue to grow and offer solid products to our customers. They have always been very responsive to bugs, and as a result the number of tickets that we've had to log with them has dropped significantly every year, to the point that it's now surprising when we have to log one.",67,4.526315789473684,4.526315789473684,4.526315789473684,4.578947368421052,4.473684210526316,4.131578947368421,6
460,Ephesoft Transact,Wouter V.,Overall: Our overall experience is very good. Our company is working with Ephesoft for over 4 years now and implemented the solution with many customers. The way you setup the workflow of Ephesoft is very easy and you can easily add or delete several modules depending on the customers needs. This makes the application a good fit for a large variety of business needs.,67,4.526315789473684,4.526315789473684,4.526315789473684,4.578947368421052,4.473684210526316,4.131578947368421,6
461,Ephesoft Transact,John P.,"Overall: We implemented Ephesoft as a cloud service serving multiple customers and integrated Ephesoft with our invoice automation software for ERP systems like SAP, Microsoft, Exact, King, Afas and Unit 4. ",67,4.526315789473684,4.526315789473684,4.526315789473684,4.578947368421052,4.473684210526316,4.131578947368421,6
462,Ephesoft Transact,Robert K.,"Overall: OCR / Full text, access to instances for many different groups, .... ",67,4.526315789473684,4.526315789473684,4.526315789473684,4.578947368421052,4.473684210526316,4.131578947368421,6
463,Ephesoft Transact,Mohamed S.,Overall: Transact helps us extract key data points from complex but templated contractual documents with very less manual intervention with highest possible quality.,67,4.526315789473684,4.526315789473684,4.526315789473684,4.578947368421052,4.473684210526316,4.131578947368421,6
464,Ephesoft Transact,Kevin E.,Overall: This solution has been a sea of change for us. We're moving toward paperless workflow and we've opened doors for scanning on the front end. It's a very positive change.,67,4.526315789473684,4.526315789473684,4.526315789473684,4.578947368421052,4.473684210526316,4.131578947368421,6
465,Ephesoft Transact,Aby J.,Overall: AP Automation,67,4.526315789473684,4.526315789473684,4.526315789473684,4.578947368421052,4.473684210526316,4.131578947368421,6
466,Ephesoft Transact,Vi D.,"Overall: No more paper. That saves you money long term for storage fees, paper fees and saves you space.",67,4.526315789473684,4.526315789473684,4.526315789473684,4.578947368421052,4.473684210526316,4.131578947368421,6
467,Ephesoft Transact,Verified Reviewer,Overall: Good,67,4.526315789473684,4.526315789473684,4.526315789473684,4.578947368421052,4.473684210526316,4.131578947368421,6
468,Ephesoft Transact,Rajan M.,"Overall: Overall great experience.  Very easy to set up an initial deployment.  Ephesoft team is great -- lots of talent at multiple levels (leadership, sales, engineering, support, etc.).",67,4.526315789473684,4.526315789473684,4.526315789473684,4.578947368421052,4.473684210526316,4.131578947368421,6
469,Ephesoft Transact,Kevin E.,Recommendations to other buyers: Definitely take the CBT training.  You'll be up and running in just a couple of days,67,4.526315789473684,4.526315789473684,4.526315789473684,4.578947368421052,4.473684210526316,4.131578947368421,6
470,Square 9 GlobalCapture,Ben E.,This software works pretty well.  We use it company-wide.,43,4.0,3.6923076923076925,3.3846153846153846,3.6923076923076925,3.230769230769231,3.5,7
471,Square 9 GlobalCapture,Kate G.,more stumbling blocks and pitfalls than any other product,43,4.0,3.6923076923076925,3.3846153846153846,3.6923076923076925,3.230769230769231,3.5,7
472,Square 9 GlobalCapture,Tim F.,I use Global Capture to automate processing of customs forms.,43,4.0,3.6923076923076925,3.3846153846153846,3.6923076923076925,3.230769230769231,3.5,7
473,Square 9 GlobalCapture,Guadalupe R.,"Great features, functions, and feasibility compared to similar products on the market.",43,4.0,3.6923076923076925,3.3846153846153846,3.6923076923076925,3.230769230769231,3.5,7
474,Square 9 GlobalCapture,Kim M.,"Awful, the reseller sold us support and have been awful to work with - very misleading presentation!",43,4.0,3.6923076923076925,3.3846153846153846,3.6923076923076925,3.230769230769231,3.5,7
475,Square 9 GlobalCapture,Keith D.,Global Capture 4.5,43,4.0,3.6923076923076925,3.3846153846153846,3.6923076923076925,3.230769230769231,3.5,7
476,Square 9 GlobalCapture,Larry H.,Wonderful,43,4.0,3.6923076923076925,3.3846153846153846,3.6923076923076925,3.230769230769231,3.5,7
477,Square 9 GlobalCapture,Darleen L.,Program has glitches when used on server for multi user ,43,4.0,3.6923076923076925,3.3846153846153846,3.6923076923076925,3.230769230769231,3.5,7
478,Square 9 GlobalCapture,Andrew D.,Design and implement document work flows for multiple departments,43,4.0,3.6923076923076925,3.3846153846153846,3.6923076923076925,3.230769230769231,3.5,7
479,Square 9 GlobalCapture,Justin S.,I am the administrator on our software and it has worked well so far.,43,4.0,3.6923076923076925,3.3846153846153846,3.6923076923076925,3.230769230769231,3.5,7
480,Square 9 GlobalCapture,Carl W.,"Started out good, but has been very problematic without resolution for the last 7 days.",43,4.0,3.6923076923076925,3.3846153846153846,3.6923076923076925,3.230769230769231,3.5,7
481,Square 9 GlobalCapture,Jody T.,"Software is generally easy to use, but mapping and global forms is more complicated than presented.",43,4.0,3.6923076923076925,3.3846153846153846,3.6923076923076925,3.230769230769231,3.5,7
482,Square 9 GlobalCapture,Lawrence C.,Great product!,43,4.0,3.6923076923076925,3.3846153846153846,3.6923076923076925,3.230769230769231,3.5,7
483,Square 9 GlobalCapture,Ben E.,Pros: Easy to use.  Versioning ability.  It is easy to import and export documents.  I like that up to 1000 documents can be loaded at one time.  Seems to run at the expected speed.  Flexible metadata fields.,43,4.0,3.6923076923076925,3.3846153846153846,3.6923076923076925,3.230769230769231,3.5,7
484,Square 9 GlobalCapture,Kate G.,Pros: Its User Interface for validation users is so simple and minimum that validation users can't mess up.,43,4.0,3.6923076923076925,3.3846153846153846,3.6923076923076925,3.230769230769231,3.5,7
485,Square 9 GlobalCapture,Tim F.,Pros: I like it's accuracy compared to other OCR solutions I have used.  It allows me to zone in on problem areas and configure them to find the data I'm looking for as best as possible.,43,4.0,3.6923076923076925,3.3846153846153846,3.6923076923076925,3.230769230769231,3.5,7
486,Square 9 GlobalCapture,Guadalupe R.,Pros: The customization features greatly meets our needs. Really appreciate the flexibility of the work flows.,43,4.0,3.6923076923076925,3.3846153846153846,3.6923076923076925,3.230769230769231,3.5,7
487,Square 9 GlobalCapture,Keith D.,"Pros: Once configured and setup, it works solidly.",43,4.0,3.6923076923076925,3.3846153846153846,3.6923076923076925,3.230769230769231,3.5,7
488,Square 9 GlobalCapture,Larry H.,"Pros: Before we start to use GlobalCapture, OCR is just means a software could capture wording from document. Then we found there are lots of incredible application on GlobalCapture. It's really helpful for us to process huge document everyday.",43,4.0,3.6923076923076925,3.3846153846153846,3.6923076923076925,3.230769230769231,3.5,7
489,Square 9 GlobalCapture,Darleen L.,Pros: Love the electronic invoicing approval process. Can scan and retain copies of invoices and search for them which makes audit process easier ,43,4.0,3.6923076923076925,3.3846153846153846,3.6923076923076925,3.230769230769231,3.5,7
490,Square 9 GlobalCapture,Andrew D.,Pros: The graphic interface is easy to use and quite intuitive.  Easy to follow flows throughout the process,43,4.0,3.6923076923076925,3.3846153846153846,3.6923076923076925,3.230769230769231,3.5,7
491,Square 9 GlobalCapture,Justin S.,Pros: The software is easy to use and it flows smoothly. The technical portions of administration are just as easy as the user functions. ,43,4.0,3.6923076923076925,3.3846153846153846,3.6923076923076925,3.230769230769231,3.5,7
492,Square 9 GlobalCapture,Carl W.,"Pros: When the software is working, it is accurate, quick and  creates a great efficiency for our company.",43,4.0,3.6923076923076925,3.3846153846153846,3.6923076923076925,3.230769230769231,3.5,7
493,Square 9 GlobalCapture,Jody T.,"Pros: Easy navigation, ease of training other staff through smart search is very nice.  general basic knowledge needed!",43,4.0,3.6923076923076925,3.3846153846153846,3.6923076923076925,3.230769230769231,3.5,7
494,Square 9 GlobalCapture,Lawrence C.,"Pros: The search feature, and the ability to easily store documents.  Whenever we need a document, it is so easy to search and find files that have been uploaded into the system.",43,4.0,3.6923076923076925,3.3846153846153846,3.6923076923076925,3.230769230769231,3.5,7
495,Square 9 GlobalCapture,Ben E.,Cons: Security is cumbersome to setup.  Not able to handle multiple domains in one version.  The preview window should support more file types.  In line editor sometimes does not Save the changes you make even though you did save them.,43,4.0,3.6923076923076925,3.3846153846153846,3.6923076923076925,3.230769230769231,3.5,7
496,Square 9 GlobalCapture,Kate G.,"Cons: Support. I've yet to get through to someone on the phone after over a dozen tickets opened, always a voice mail and email, then waiting hours for response.",43,4.0,3.6923076923076925,3.3846153846153846,3.6923076923076925,3.230769230769231,3.5,7
497,Square 9 GlobalCapture,Tim F.,"Cons: I don't like how once something is in the queue, I can't move it up or down in the batch manager.  This is a problem for me when I'm processing a large batch of files and need to test a new workflow or process a priority document.",43,4.0,3.6923076923076925,3.3846153846153846,3.6923076923076925,3.230769230769231,3.5,7
498,Square 9 GlobalCapture,Guadalupe R.,Cons: Hoping that increase in database size doesn't slow down the software speed. Hope to see an upgrade/solution soon.,43,4.0,3.6923076923076925,3.3846153846153846,3.6923076923076925,3.230769230769231,3.5,7
499,Square 9 GlobalCapture,Kim M.,"Cons: need better resellers and need to test them to make sure they are doing a good job selling, supporting and actually know how to use it with out having to call every question in to your office and we have to wait days to get answers. We use this company for other things but this has really made us loose faith in them. Poor service.",43,4.0,3.6923076923076925,3.3846153846153846,3.6923076923076925,3.230769230769231,3.5,7
500,Square 9 GlobalCapture,Keith D.,Cons: It can be difficult to use in conjunction with the other software offerings from Square 9 (Global Search).  Traditional Windows Applications vs Web Based Application and parity between both offerings can tend to cause user confusion.,43,4.0,3.6923076923076925,3.3846153846153846,3.6923076923076925,3.230769230769231,3.5,7
501,Square 9 GlobalCapture,Larry H.,Cons: Maybe it could more easy when doing setup. It still requires lots knowledge and know how then could start to use this software.,43,4.0,3.6923076923076925,3.3846153846153846,3.6923076923076925,3.230769230769231,3.5,7
502,Square 9 GlobalCapture,Darleen L.,Cons: On a server the program loses its connection often. This creates a down time for the business in processing invoices ,43,4.0,3.6923076923076925,3.3846153846153846,3.6923076923076925,3.230769230769231,3.5,7
503,Square 9 GlobalCapture,Andrew D.,Cons: I have found some confusion in assigning OCR templates to a workflow.  This may be a result of us moving our installation from one server to another,43,4.0,3.6923076923076925,3.3846153846153846,3.6923076923076925,3.230769230769231,3.5,7
504,Square 9 GlobalCapture,Justin S.,Cons: The security heavy settings are a bit cumbersome and take a lot of attention to make sure they are correct.,43,4.0,3.6923076923076925,3.3846153846153846,3.6923076923076925,3.230769230769231,3.5,7
505,Square 9 GlobalCapture,Carl W.,Cons: There have been a lot of inconsistencies lately that even the support team can not seem to identify the problem and resolve it.,43,4.0,3.6923076923076925,3.3846153846153846,3.6923076923076925,3.230769230769231,3.5,7
506,Square 9 GlobalCapture,Jody T.,Cons: Global forms -- the advanced training we took was rather hard to follow for being new to the system.  Mapping and indexing fields every time a change on form is made.,43,4.0,3.6923076923076925,3.3846153846153846,3.6923076923076925,3.230769230769231,3.5,7
507,Square 9 GlobalCapture,Lawrence C.,"Cons: Uploading files, and 'labeling them'.  It is very cumbersome to take the file (once scanned) and enter the fields into the software.",43,4.0,3.6923076923076925,3.3846153846153846,3.6923076923076925,3.230769230769231,3.5,7
508,Square 9 GlobalCapture,Ben E.,Overall: Ability to have a central repository that is version controlled for users to manage documents.,43,4.0,3.6923076923076925,3.3846153846153846,3.6923076923076925,3.230769230769231,3.5,7
509,Square 9 GlobalCapture,Kim M.,Overall: NA - still in set up mode,43,4.0,3.6923076923076925,3.3846153846153846,3.6923076923076925,3.230769230769231,3.5,7
510,Square 9 GlobalCapture,Keith D.,Overall: We've been able to use GlobalCapture to index and archive all of our payables invoices.,43,4.0,3.6923076923076925,3.3846153846153846,3.6923076923076925,3.230769230769231,3.5,7
511,Square 9 GlobalCapture,Darleen L.,Overall: Electronic process of invoices. Invoice retention. Streamline process from Square9 to QuickBooks ,43,4.0,3.6923076923076925,3.3846153846153846,3.6923076923076925,3.230769230769231,3.5,7
512,Square 9 GlobalCapture,Lawrence C.,"Overall: Data storage, and the ability to quickly find files.",43,4.0,3.6923076923076925,3.3846153846153846,3.6923076923076925,3.230769230769231,3.5,7
513,ABBYY FlexiCapture,Jordan K.,FlexiCapture is truly the Flexible,25,4.25,3.75,4.375,4.5,4.625,4.125,8
514,ABBYY FlexiCapture,Devinder Singh G.,Best product to capture the hard copy records to store in system ,25,4.25,3.75,4.375,4.5,4.625,4.125,8
515,ABBYY FlexiCapture,Verified Reviewer,Great software that uses OCR to read the contents of a scanned image and then perform some actions ,25,4.25,3.75,4.375,4.5,4.625,4.125,8
516,ABBYY FlexiCapture,Jason P.,Abbyy Flexicapture upgrade / replacement,25,4.25,3.75,4.375,4.5,4.625,4.125,8
517,ABBYY FlexiCapture,Adam A.,probably good if you don't have a lot of integration,25,4.25,3.75,4.375,4.5,4.625,4.125,8
518,ABBYY FlexiCapture,David B.,Almost limitless scope,25,4.25,3.75,4.375,4.5,4.625,4.125,8
519,ABBYY FlexiCapture,Tomasz W.,FlexiCapture is powerfull tool,25,4.25,3.75,4.375,4.5,4.625,4.125,8
520,ABBYY FlexiCapture,Verified Reviewer,Document data mining,25,4.25,3.75,4.375,4.5,4.625,4.125,8
521,ABBYY FlexiCapture,Jordan K.,Pros: Flexibility and removing over 80% of our data-entry.,25,4.25,3.75,4.375,4.5,4.625,4.125,8
522,ABBYY FlexiCapture,Devinder Singh G.,Pros: Create one template for single type or one typed hardcopy and rest of the work has been done by flexi capture ,25,4.25,3.75,4.375,4.5,4.625,4.125,8
523,ABBYY FlexiCapture,Verified Reviewer,Pros: It enabled the business to save time and money and eliminate a manual process which involved scanning and emailing an invoice to a particular client. It is generally easy to use for staff. Any exceptions or failures could be seen on the verification station and dealt with. ,25,4.25,3.75,4.375,4.5,4.625,4.125,8
524,ABBYY FlexiCapture,Jason P.,Pros: The flexibility,25,4.25,3.75,4.375,4.5,4.625,4.125,8
525,ABBYY FlexiCapture,Adam A.,Pros: Takes paper out of the mix.  Easy to get approvals and to do invoice validations again your ERP system.,25,4.25,3.75,4.375,4.5,4.625,4.125,8
526,ABBYY FlexiCapture,Verified Reviewer,"Pros: Application after installation is very user friendly with part of AI, when you correct it, it learnt it :-)",25,4.25,3.75,4.375,4.5,4.625,4.125,8
527,ABBYY FlexiCapture,Jordan K.,"Cons: The line-item error messages for item's that we are not using is very annoying, but workable.",25,4.25,3.75,4.375,4.5,4.625,4.125,8
528,ABBYY FlexiCapture,Devinder Singh G.,Cons: Currently the hardcopy with low ppt cant be recognised 100 percent correct need to do extra effort in that,25,4.25,3.75,4.375,4.5,4.625,4.125,8
529,ABBYY FlexiCapture,Verified Reviewer,Cons: If a section in a batch failed verification the the remainder of the batch wouldn't be verified until the failure was cleared. We frequently saw SharePoint related exceptions and they would often require a few retries (send the document back to processing) before the document would go through to SharePoint. ,25,4.25,3.75,4.375,4.5,4.625,4.125,8
530,ABBYY FlexiCapture,Adam A.,Cons: Always having slowness issues.  They want you to update the software all the time and you have to do an uninstall/reinstall.,25,4.25,3.75,4.375,4.5,4.625,4.125,8
531,ABBYY FlexiCapture,Verified Reviewer,Cons: A little complicated initial setup and run.,25,4.25,3.75,4.375,4.5,4.625,4.125,8
532,ABBYY FlexiCapture,Jordan K.,"Overall: Consolidated Metco choose ABBYY after an extensive review and vetting process.  A review of 14 OCR options ultimately ended with FlexiCapture as the winner.  The ABBYY support offered through UFC is nothing less than THE pinnacle of service.  Our questions, concerns, and mistakes are always met with efficient and well thought solutions.  With the implementation assistance from UFC, we automated the entry of 35,000+ invoices and POs so far in 2016.  Our people that were doing data-entry are now quickly verifying scans and moving onto other tasks.   ",25,4.25,3.75,4.375,4.5,4.625,4.125,8
533,ABBYY FlexiCapture,Devinder Singh G.,Overall: Easy to store hard copy result in system. ,25,4.25,3.75,4.375,4.5,4.625,4.125,8
534,ABBYY FlexiCapture,Verified Reviewer,Overall: Works as we expect.,25,4.25,3.75,4.375,4.5,4.625,4.125,8
535,ABBYY FlexiCapture,David B.,"Comments: We have been using FlexiCapture standalone for processing a variety of complex donation forms for the last 7 years, and we have been pleasantly surprised by its flexibility.",25,4.25,3.75,4.375,4.5,4.625,4.125,8
536,ABBYY FlexiCapture,Tomasz W.,Comments: FlexiCapture made it easy to scan&amp;recognize 300k of questionnares in a simply and organaizde manner.,25,4.25,3.75,4.375,4.5,4.625,4.125,8
537,ABBYY FlexiCapture,Jordan K.,Recommendations to other buyers: Make sure your partner is UFC and it will be implemented correctly.,25,4.25,3.75,4.375,4.5,4.625,4.125,8
538,Poimapper,Cristina R.,"We made the best out of our work using Poimapper, as it is so easy to use!",18,4.625,4.5,4.875,4.5,4.875,4.5,9
539,Poimapper,Norma P.,PoiMapper is empowering Inovus Solar to power communities,18,4.625,4.5,4.875,4.5,4.875,4.5,9
540,Poimapper,David D.,Real potential to be a Programme Management tool,18,4.625,4.5,4.875,4.5,4.875,4.5,9
541,Poimapper,Jinja H.,"This software is easy to use, it is versatile and it has many different possibilities. ",18,4.625,4.5,4.875,4.5,4.875,4.5,9
542,Poimapper,Brenda B.,A versatile and easy-to-use data collection tool,18,4.625,4.5,4.875,4.5,4.875,4.5,9
543,Poimapper,Marc L.,Great tool for creating custom data forms for field projects,18,4.625,4.5,4.875,4.5,4.875,4.5,9
544,Poimapper,Mika V.,Excellent tool for mobile data collection in the field ,18,4.625,4.5,4.875,4.5,4.875,4.5,9
545,Poimapper,Minna H.,Real time - real data - real easy,18,4.625,4.5,4.875,4.5,4.875,4.5,9
546,Poimapper,Cristina R.,Pros: Poimapper is very intuitive and easy to use. We worked with it practically without consulting tutorials!,18,4.625,4.5,4.875,4.5,4.875,4.5,9
547,Poimapper,Cristina R.,Cons: Some improvements could be made in charts and reports to make them editable in Excel or Word. ,18,4.625,4.5,4.875,4.5,4.875,4.5,9
548,Poimapper,Cristina R.,"Overall: We could easily store all our forms in one platform, view the progress of our work, make adjustments in the forms and treat the data in a quick and simple way, which otherwise would take us ages to manage!",18,4.625,4.5,4.875,4.5,4.875,4.5,9
549,Poimapper,Norma P.,"Comments: In order for Inovus LocalSolar projects to be successful, each individual light poles characteristics need to be captured, recorded, and mapped to determine the structural feasibility. By simply using a mobile phone, PoiMapper allows Inovus Solar to quickly record each poles details, take pictures, and map its GPS coordinates. Once the pole details are gathered, the field technician instantaneously uploads the data to the cloud making mobile phones the most powerful tool in the Inovus Solar toolkit.  The program helps eliminate field errors and vastly improved the quality of our data collection process that is critical to our success. Just as important, it has also improved our collaboration between our Engineers and Project Managers giving the team instant access to the data.",18,4.625,4.5,4.875,4.5,4.875,4.5,9
550,Poimapper,David D.,"Comments: Poimapper is well known as a datacapture tool and I have been using the product for over 3 years as part of an HIV/maternal health programme in 4 countries in Africa. The product generally works well in terms of datacapture on mobiles (smartphones and Tablets). The newer version includes intelligent logic which is useful, although we have had some data issues when conducting large complex surveys. The main benefit is that the data is stored on the phone as well as the server. The webportal, where data is viewed and can be downloaded, is continually improving. Standard reporting and dashboard facilities, however still need significant improvement. The admin control - creating surveys and administering user permissions - I still find quite difficult to use - not very intuitive and requiring a fast internet connection to work well which is often a challenge in sub-Sahara Africa. What is needed in my opinion for first line Managers is a simple reporting tool that they can easily and routinely access as a monitoring tool. Pajat provide responsive customer service and at our request they have integrated a documents section into our application which is very useful - containing all training and project information. We also separately use a mobile instant messenger (MIM)  application for low cost communication. I do believe the Poimapper application has the potential, by integrating other features such as documents and MIM, to become a full programme management tool, not simply facilitating monitoring and evaluation but also helping to improve ongoing programme management effectiveness.   ",18,4.625,4.5,4.875,4.5,4.875,4.5,9
551,Poimapper,Jinja H.,Comments: Reportage in our company before this software has been quite slow and we havent been able to deliver final raportage to our clients enough fast. It might took several days at least to collect every employees report and make it a one whole report where all the numbers and information is in one place. Reportage was also always on paper and it made everything so much difficult and slow.  ,18,4.625,4.5,4.875,4.5,4.875,4.5,9
552,Poimapper,Brenda B.,Comments: Pro's:,18,4.625,4.5,4.875,4.5,4.875,4.5,9
553,Poimapper,Marc L.,"Comments: Our team at Oceanwide Science Institute uses Poimapper to record a wide range of data during our marine surveys.  The functionality of the software allows us to efficiently collect and process data points in the field. The ability to create customized data forms allows us to capture the information specifically relevant to our project. Poimapper offers the option to automatically upload the data points so they are ready for analysis when we return to the office, which is a significant time saver!  In addition, the program is user friendly and intuitive. Poimapper has worked really well for us and we would recommend the app to anyone looking for an efficient, customizable data collection tool. ",18,4.625,4.5,4.875,4.5,4.875,4.5,9
554,Poimapper,Mika V.,"Comments: Plan International has been using Poimapper for 5 years now and its currently utilized in over 20 countries around the world. The use cases vary from M&amp;E data collection to Rapid Needs Assessment during disasters, program implementation support to pilots in sponsorship data collection. Plan International staff in numerous countries have been very satisfied with Poimapper and thus we are continuously extending its use in our organisation.  Ease of use, reliability, user support and advanced cloud portal make it ideal for our use. Happy to see that also the analysis and reporting side has been updated and improved recently. ",18,4.625,4.5,4.875,4.5,4.875,4.5,9
555,Poimapper,Minna H.,Comments: Reporting took too much energy from everyone before.... and it took too much time. Now we know all the time what's going on in every location. ,18,4.625,4.5,4.875,4.5,4.875,4.5,9
556,iCapture,Christopher M.,"From My Initial Phone Inquiry to My Panic Phone Call an Hour Before Show Open, Their Service Was A++",26,4.571428571428571,4.0,4.857142857142857,4.142857142857143,4.714285714285714,4.142857142857143,10
557,iCapture,Patti C.,iCapture has saved us money and added functionality,26,4.571428571428571,4.0,4.857142857142857,4.142857142857143,4.714285714285714,4.142857142857143,10
558,iCapture,ANTONIS D.,I use this software for connecting my iPhone into my Mac. Its really useful and easy to use. ,26,4.571428571428571,4.0,4.857142857142857,4.142857142857143,4.714285714285714,4.142857142857143,10
